げつめんつあーへようこそ, 月面ツアーへようこそ Welcome to Lunatic City., 名詞
げつめんつあーへようこそ, 月面ツアーへようこそ, 名詞
てんくうのぐりにっじ, 天空のグリニッジ Royal Greenwich Observatory, 名詞
てんくうのぐりにっじ, 天空のグリニッジ, 名詞
ひがしのくにのねむらないよる, 東の国の眠らない夜 Vampirish Nightlife, 名詞
ひがしのくにのねむらないよる, 東の国の眠らない夜, 名詞
くるまいすのみらいうちゅう, 車椅子の未来宇宙 History of Time, 名詞
くるまいすのみらいうちゅう, 車椅子の未来宇宙, 名詞
でぃーみすてぃふぁいふぃーすと, Demystify Feast 神秘性のベールの向こう側, 名詞
でぃーみすてぃふぁいふぃーすと, Demystify Feast, 名詞
えいせいかふぇてらす, 衛星カフェテラス Satellite Cafe, 名詞
えいせいかふぇてらす, 衛星カフェテラス, 名詞
ｇｆれえ, G Free Zero Gravity, 名詞
ｇｆれえ, G Free, 名詞
じーふりー, G Free, 名詞
おおぞらまじゅつ, 大空魔術 ~ Magical Astronomy, 名詞
おおぞらまじゅつ, 大空魔術, 名詞
ねくろふぁんたじあ, ネクロファンタジア Necrophantasia, 名詞
むこうがわのつき, 向こう側の月 Megalopolis of Moon, 名詞
むこうがわのつき, 向こう側の月, 名詞
